<?xml version="1.0" encoding="UTF-8"?>

<spec
        xmlns:xsi="http://www.w3.org/2001/XMLSchema-instance"
        xmlns="http://pampasim.org/"
        xmlns:events="http://pampasim.org/events"
        xmlns:process="http://pampasim.org/events/process"
        xmlns:decls="http://pampasim.org/spec/decls"
        xsi:schemaLocation=
                "http://pampasim.org/  /org/pampasim/spec.xsd
                 http://pampasim.org/events/ /org/pampasim/events/event.xsd
                 http://pampasim.org/events/process/ /org/pampasim/events/processCreationData.xsd
                 http://pampasim.org/spec/decls/ /org/pampasim/resources/specDecls.xsd"
        >
    <version>
        <major>0</major>
        <minor>0</minor>
        <patch>0</patch>
    </version>
    <entities>
        <entity>
            <decls:fullyQualifiedClassName>org.pampasim.entity.schedulers.FCFS</decls:fullyQualifiedClassName>
        </entity>
    </entities>
    <stimuli>
    </stimuli>
</spec>